{
 "meta": {
  "slug": "angola",
  "titulo": "Cuba en Angola: la sangre y el negocio",
  "subtitulo": "Medio siglo de una misma operación: primero el ejército (1975-1991), después los médicos (2007-hoy). Quién cobró, quién pagó y cuántos no volvieron.",
  "actualizado": "2026-07-11",
  "fuentes": [
   "Archivo Cuba / Free Society Project (informe 2017, punto de partida)",
   "Piero Gleijeses (Johns Hopkins, archivos cubanos y soviéticos)",
   "Cubanet",
   "Diario de Cuba",
   "14ymedio",
   "elTOQUE",
   "Connectas",
   "Martí Noticias",
   "Café Fuerte",
   "El Debate",
   "Jornal F8 (Angola)",
   "HALO Trust",
   "Prisoners Defenders",
   "Relatores Especiales de la ONU",
   "MEP / estadística oficial cubana",
   "Freedom Park (Sudáfrica)"
  ],
  "nota_registro": "Este expediente parte de un informe de Archivo Cuba (2017) y cada afirmación fue verificada de forma independiente antes de entrar aquí. Lo corroborado se presenta como dato; lo que solo tiene una fuente, un testimonio o una denuncia de época se marca visible como tal y vive en su propia sección. Las cifras oficiales cubanas de muertos no coinciden entre sí: se muestran todas, con su fecha y su origen, en vez de elegir una.",
  "descripcion": "Expediente sobre la presencia cubana en Angola en sus dos actos: la intervención militar de 1975 a 1991 (Operación Carlota: 377.033 militares y unos 50.000 cooperantes civiles según la cifra oficial dada por Raúl Castro en 1991) y el negocio de exportación de servicios profesionales reactivado desde 2007 y todavía activo (1.243 colaboradores de salud en octubre de 2024 según el ministro de Salud cubano). Documenta la divergencia entre las cifras oficiales de muertos (2.016, 2.077 y 2.289 según el recuento y la fecha) y los estimados independientes (1.400 según la CIA ya en 1978; alrededor de 10.000 según el general desertor Rafael del Pino y estimados estadounidenses de 1987); la economía de la intervención (pagos estimados de 300 a 600 millones de dólares anuales a La Habana mientras el recluta cobraba 7 pesos cubanos al mes); y la economía de la misión médica (Angola paga unos 5.000 dólares mensuales por médico, confirmado por la ministra de Salud angoleña en 2020, mientras el profesional recibe una fracción mínima y el resto lo retiene el Estado cubano vía Antex S.A., empresa del conglomerado militar GAESA). Incluye la dimensión angoleña (más de 500.000 muertos de guerra civil, decenas de miles de amputados por minas) y una sección explícita de alegaciones no corroboradas (armas químicas, saqueo de marfil y diamantes, trueque petróleo por servicios) que la verificación no permitió asentar como hechos.",
  "narracion": "Hay una línea que une al soldado cubano de 1975 con el médico cubano de hoy, y pasa por Angola. Según la cifra oficial, trescientos setenta y siete mil militares cubanos pasaron por la guerra de Angola entre 1975 y 1991. Cuántos murieron sigue sin lista oficial: las propias cifras del Estado oscilan entre dos mil dieciséis y dos mil doscientos ochenta y nueve, mientras el general desertor Rafael del Pino y los estimados estadounidenses hablaban de unos diez mil. El recluta cobraba siete pesos al mes; el Estado, según los estimados que circulan, entre trescientos y seiscientos millones de dólares al año. La guerra terminó, el negocio no: desde 2007 Cuba exporta médicos a Angola a través de Antex, una empresa del conglomerado militar GAESA. Angola paga unos cinco mil dólares mensuales por cada médico, lo confirmó su propia ministra de Salud; al médico le llega una fracción mínima y el resto queda retenido en Cuba. La Organización de las Naciones Unidas califica ese esquema, desde 2019, de posible trabajo forzoso. En octubre de 2024 seguían allí mil doscientos cuarenta y tres colaboradores de salud. Medio siglo después, Angola sigue siendo el espejo donde el internacionalismo cubano se mira y aparece un negocio.",
  "narracion_en": "There is a line connecting the Cuban soldier of nineteen seventy-five with the Cuban doctor of today, and that line runs through Angola. In November nineteen seventy-five, Fidel Castro launched Operation Carlota. Over the following sixteen years, according to the official figure given by Raúl Castro at the war's end, three hundred and seventy-seven thousand and thirty-three Cuban soldiers and some fifty thousand civilian aid workers passed through Angola. Academic historiography, working from Cuban and Soviet archives, established that the request came from Angola's Agostinho Neto and that Havana decided to intervene with remarkable autonomy; Moscow, reluctant at first, supplied the weapons. Cuba did not serve for free: circulating estimates speak of three hundred to six hundred million dollars a year for the Cuban state. The conscript, meanwhile, earned seven Cuban pesos a month. How many died remains a state secret. Even the official figures disagree: the list read at the eighty-nine burials held two thousand two hundred and eighty-nine names, counting those fallen in other countries; of them, some two thousand and sixteen died in Angola; Raúl Castro said in nineteen ninety-one the total was two thousand and seventy-seven. The CIA calculated fourteen hundred dead as early as nineteen seventy-eight, with twelve years of war still ahead. And General Rafael del Pino, the highest-ranking defector, held in nineteen eighty-seven that the toll was around ten thousand, a figure matching United States government estimates. In December nineteen eighty-nine, Operation Tribute buried the repatriated remains across the country's one hundred and sixty-nine municipalities, and then came what one veteran called the olympic oblivion. Angola paid an even higher price: more than half a million dead in its civil war and tens of thousands of amputees from landmines still being dug up today. The war ended in nineteen ninety-one, but the business did not. In two thousand seven the cooperation was reborn as a contract: Cuban doctors, teachers and engineers deployed through Antex, a company of the military conglomerate GAESA. By two thousand fourteen there were four thousand workers. Angola pays about five thousand dollars a month for each doctor; Angola's own health minister confirmed it. The doctor receives a minimal fraction, and much of the rest stays in Havana, in a fund payable only if the mission ends without desertion. Since two thousand nineteen, the United Nations has described that scheme as possible forced labour. When Angolan oil got cheap, the defaults arrived: Angolan scholarship students in Cuba went eight months without their stipend, and in August two thousand seventeen Luanda went as far as rejecting one hundred and eighty-nine Cuban health workers who were ready to fly. Even so, the mission continues: one thousand two hundred and forty-three health workers in October two thousand twenty-four, and the export of services remains the Cuban state's top source of hard currency, at more than five billion dollars a year. Some things this dossier does not assert as fact, because verification could not carry them, and they are shown for what they are: the nineteen eighty-eight chemical weapons allegation, the ivory and diamond plunder recounted by a single book, the alleged oil-for-services barter. Honesty with sources is the house rule. What is established suffices: half a century on, Angola remains the mirror in which Cuban internationalism looks at itself and sees a business."
 },
 "kpis": [
  {
   "id": "militares",
   "valor": "377.033",
   "etiqueta": "militares cubanos pasaron por Angola (1975-1991), más ~50.000 cooperantes civiles",
   "fuente": "cifra oficial, Raúl Castro, mayo 1991"
  },
  {
   "id": "muertos",
   "valor": "2.077-2.289",
   "etiqueta": "muertos según las propias cifras oficiales (que no coinciden entre sí); ~10.000 según estimados independientes",
   "fuente": "listas oficiales 1989/1991 · Del Pino / EEUU 1987"
  },
  {
   "id": "pago_medico",
   "valor": "$5.000",
   "etiqueta": "paga Angola al mes por cada médico cubano; el médico recibe una fracción mínima",
   "fuente": "confirmado por la ministra de Salud angoleña, 2020"
  },
  {
   "id": "mision_hoy",
   "valor": "1.243",
   "etiqueta": "colaboradores de salud cubanos seguían en Angola en octubre de 2024",
   "fuente": "ministro de Salud de Cuba, oct 2024"
  }
 ],
 "cronologia": [
  {
   "ano": 1975,
   "fecha": "noviembre de 1975",
   "titulo": "Arranca la Operación Carlota",
   "acto": "guerra",
   "texto": "Las primeras tropas cubanas llegan a Angola en la primera semana de noviembre. La historiografía académica (Piero Gleijeses, con archivos cubanos y soviéticos) estableció que la solicitud vino de Agostinho Neto y el MPLA, y que La Habana decidió intervenir con considerable autonomía: Moscú, reticente al inicio, aportó el armamento pero no la iniciativa.",
   "fuente": "Gleijeses; archivos citados en uOttawa/Recipro"
  },
  {
   "ano": 1978,
   "fecha": "julio de 1978",
   "titulo": "La CIA ya cuenta 1.400 muertos",
   "acto": "guerra",
   "texto": "El País reporta un cálculo de la CIA de 1.400 cubanos muertos en los primeros años de la intervención. Quedaban doce años más de guerra.",
   "fuente": "cálculo CIA citado por prensa de época"
  },
  {
   "ano": 1988,
   "fecha": "1987-1988",
   "titulo": "Cuito Cuanavale y el principio del fin",
   "acto": "guerra",
   "texto": "La batalla de Cuito Cuanavale precede los acuerdos que encadenan la retirada cubana con la independencia de Namibia. Ese mismo año circula la denuncia de uso de armas químicas: nunca llegó a certificación institucional de la ONU (ver sección de alegaciones).",
   "fuente": "acuerdos de Nueva York, dic 1988"
  },
  {
   "ano": 1989,
   "fecha": "6-7 de diciembre de 1989",
   "titulo": "Operación Tributo",
   "acto": "guerra",